Timestamp,Question,Answer
2024-10-12 17:50:01.915821,4.	¿Cómo se sienten los usuarios acerca de las características de Amazon Prime Music cuando se usa en una PC?,"Para analizar cómo se sienten los usuarios acerca de las características de Amazon Prime Music cuando se usa en una PC, es importante considerar las reseñas y opiniones disponibles en la plataforma. 

En general, basándonos en el contexto proporcionado por el usuario que menciona problemas al intentar usar Prime Music fuera de Estados Unidos, podemos inferir que existen algunas dificultades relacionadas con la geolocalización y la compatibilidad regional de la aplicación.

Algunos insights potenciales podrían ser:

- Los usuarios pueden experimentar frustración al intentar acceder a contenido de Prime Music desde ubicaciones fuera de Estados Unidos debido a restricciones geográficas.
- La experiencia de uso puede variar dependiendo del país donde se esté utilizando la aplicación, lo que puede llevar a situaciones como bloqueos de contenido o solicitudes constantes de verificación de membresía.
- Es posible que los usuarios encuentren limitaciones en la funcionalidad de Prime Music en comparación con otras aplicaciones dentro del ecosistema Amazon, como Prime Video, lo cual podría generar insatisfacción.

En resumen, los usuarios podrían sentirse descontentos o decepcionados al utilizar Amazon Prime Music en una PC fuera de Estados Unidos debido a problemas relacionados con la membresía, acceso al contenido y funcionalidades limitadas.

Diagnóstico de polaridad: Negativo"
2024-10-12 17:50:27.612409,How do users feel about the features of Amazon Prime Music when used on a PC?,"Para analizar cómo se sienten los usuarios acerca de las características de Amazon Prime Music al ser utilizado en una PC, es importante revisar las reseñas proporcionadas en el contexto. A continuación, se presentan algunos insights basados en las opiniones expresadas:

1. **Tamaño de la biblioteca musical**: Un usuario menciona que le gustaría que la selección de música fuera más amplia, lo que sugiere que la variedad de canciones disponibles podría ser un factor importante para los usuarios al evaluar la plataforma.

2. **Costos adicionales**: Otro comentario señala que no está contento con tener que pagar extra por acceder a música ilimitada, incluso siendo miembro de Amazon Prime. Esto indica que el modelo de suscripción y los costos asociados pueden influir en la percepción de los usuarios sobre las características del servicio.

3. **Compatibilidad**: Algunos usuarios han experimentado problemas de compatibilidad con dispositivos específicos, como tablets HP, lo cual puede afectar la experiencia general al utilizar Amazon Prime Music en diferentes plataformas.

4. **Experiencia internacional**: Se menciona una dificultad específica relacionada con el uso de Amazon Prime Music fuera de Estados Unidos, lo cual destaca la importancia de la accesibilidad global y su impacto en la satisfacción del usuario.

En conclusión, las opiniones recopiladas sugieren que los usuarios pueden sentirse limitados por aspectos como la disponibilidad de contenido, costos adicionales y compatibilidad con diversos dispositivos al utilizar Amazon Prime Music en una PC. Estos factores pueden influir significativamente en la percepción y satisfacción del usuario con respecto a las características ofrecidas por el servicio.

Diagnóstico de polaridad: Las opiniones expresadas abarcan tanto aspectos positivos (como la facilidad para jugar diferentes juegos) como negativos (como limitaciones en la biblioteca musical y problemas de compatibilidad), lo que refleja una polaridad mixta en las experiencias compartidas por los usuarios."
2024-10-12 17:50:45.428185,5.	Welches Feedback geben Benutzer über die Leistung von Photoshop nach jahrelanger Nutzung?,"No tengo suficiente información para responder a esta pregunta. Por favor, proporciona más detalles sobre el producto o aspecto específico que deseas analizar en relación con la lección de Photoshop después de años de uso."
2024-10-12 17:50:59.460010,Welches Feedback geben Benutzer über die Leistung von Photoshop nach jahrelanger Nutzung?,"Para analizar el feedback de los usuarios sobre la performance de Photoshop después de años de uso, es necesario revisar las reseñas relevantes en Amazon. A continuación, se presentan algunas observaciones basadas en las reseñas proporcionadas:

- Los usuarios expresan que el programa les resulta muy útil y rápido, casi haciendo innecesario el uso de Photoshop para muchas de sus fotos.
- Se destaca la facilidad para copiar ajustes de una foto a otra, lo cual agiliza el proceso de edición.
- Sin embargo, también se menciona la dificultad para obtener respuestas a problemas menores por parte del soporte técnico de la empresa. Algunos usuarios experimentaron demoras significativas en recibir asistencia.
- Otros usuarios encuentran la interfaz confusa y esperan mejoras en versiones futuras del software.

En conclusión:
- A pesar de las funcionalidades positivas y eficiencia del programa, la atención al cliente y la claridad en la interfaz parecen ser áreas que podrían mejorar según las opiniones recopiladas.

Diagnóstico de polaridad: 
Las opiniones reflejan una mezcla de experiencias positivas y negativas, con aspectos destacables pero también áreas problemáticas a considerar."
2024-10-12 17:59:02.362012,"Amazon Prime Music no puede competir con Spotify en cuanto a la calidad de sonido, ¿cómo justifican los usuarios seguir usándolo?","Puedo ayudarte con el análisis de reseñas de productos en Amazon, proporcionando insights para mejorar la experiencia del cliente o el desarrollo de productos. ¿En qué área específica deseas que te ayude?"
2024-10-12 17:59:52.189465,"Amazon Prime Music no puede competir con Spotify en cuanto a la calidad de sonido, ¿cómo justifican los usuarios seguir usándolo?","Puedo ayudarte con el análisis de reseñas de productos en Amazon, proporcionando insights para mejorar la experiencia del cliente o el desarrollo de productos. ¿En qué área específica deseas que te ayude?"
2024-10-12 18:00:42.505407,¿Qué opinan los usuarios sobre Amazon Music?,"Puedo ayudarte con el análisis de reseñas de productos en Amazon, proporcionando insights para mejorar la experiencia del cliente o el desarrollo de productos. ¿En qué área específica deseas que te ayude?"
2024-10-12 18:00:49.673079,¿Qué opinan los usuarios sobre Amazon Music?,"Puedo ayudarte con el análisis de reseñas de productos en Amazon, proporcionando insights para mejorar la experiencia del cliente o el desarrollo de productos. ¿En qué área específica deseas que te ayude?

Para responder a tu consulta sobre Amazon Music, analicemos las reseñas proporcionadas:

- Se menciona que las aplicaciones de Prime Video y otros funcionan bien en Brasil, pero Amazon Music no es amigable y presenta problemas al acceder al contenido con una membresía Prime.
- A pesar de algunos problemas técnicos, se destaca que la aplicación es buena con pocos errores.
- Los usuarios expresan satisfacción general con la aplicación, aunque les gustaría una selección musical más amplia sin tener que pagar extra por música ilimitada.
- Algunos usuarios reportan que la biblioteca musical puede ser limitada y que canciones descargadas a veces se vuelven no disponibles con el tiempo.

En conclusión, los usuarios tienen opiniones mixtas sobre Amazon Music. Mientras algunos valoran la calidad general de la aplicación, otros destacan limitaciones en la biblioteca musical y problemas técnicos. La posibilidad de descargar música a un precio más accesible es apreciada, pero existen preocupaciones sobre la disponibilidad de ciertas canciones. La polaridad de las opiniones varía entre positivas y negativas, lo que indica una percepción diversa entre los usuarios."
2024-10-12 18:01:10.668388,¿Cómo describen su experiencia con TurboTax?,"Para describir la experiencia con TurboTax basada en las reseñas proporcionadas, se pueden extraer varios puntos clave:

- **Facilidad de uso y navegación**: Los usuarios mencionan que TurboTax es fácil de usar tanto para impuestos federales como estatales, lo que facilita el proceso de declaración de impuestos.

- **Actualizaciones y soporte técnico**: Se destaca que las actualizaciones son importantes para garantizar un funcionamiento óptimo del software. Sin embargo, algunos usuarios experimentaron problemas al intentar actualizar el software en sistemas Mac, lo que resultó en la necesidad de presentar físicamente las formas en lugar de presentar electrónicamente.

- **Capacidad predictiva y precisión**: Algunos usuarios expresan frustración con la capacidad predictiva del software para calcular los impuestos del año actual (2021) basándose en reglas fiscales anteriores. Se señala que las predicciones pueden ser inexactas y no reflejar con precisión la situación fiscal real.

- **Valor percibido y compromiso de H&R Block**: Un usuario elogia el software H&R Block por su facilidad de uso, guía paso a paso y actualizaciones oportunas. Además, destaca el respaldo y compromiso de H&R Block con los usuarios, ofreciendo beneficios similares a los obtenidos en sus oficinas de preparación de impuestos.

En conclusión, las opiniones sobre TurboTax varían desde la satisfacción por su simplicidad hasta la frustración por problemas técnicos y discrepancias en los cálculos fiscales. La capacidad predictiva del software parece ser un área de mejora identificada por los usuarios. La experiencia general con TurboTax está influenciada por factores como la facilidad de uso, la precisión en los cálculos fiscales y el soporte técnico ofrecido."
2024-10-12 18:01:28.998142,¿Qué tan efectiva consideran los usuarios la protección de McAfee Internet Security frente a amenazas específicas como ransomware y spyware?,"La protección de McAfee Internet Security frente a amenazas específicas como ransomware y spyware parece no ser efectiva según las reseñas analizadas. Los usuarios han expresado diversas preocupaciones y problemas con el software:

- Varios usuarios mencionan que el software no protege eficazmente contra amenazas específicas como ransomware y spyware.
- Se reportan dificultades en la activación de suscripciones, lo que genera frustración y sensación de desperdicio de tiempo y dinero.
- La lentitud en cargar la aplicación, junto con problemas para mantener la protección actualizada automáticamente, ha llevado a algunos usuarios a cuestionar la efectividad del software en general.
- Algunos usuarios han optado por desinstalar McAfee Internet Security debido a su falta de funcionalidad esperada y han considerado volver a soluciones anteriores.

En conclusión, basándonos en las reseñas analizadas, los usuarios no consideran que McAfee Internet Security brinde una protección efectiva contra ransomware y spyware, además de presentar inconvenientes en su funcionamiento general. Esta información sugiere que los usuarios podrían estar buscando alternativas más confiables para garantizar la seguridad de sus dispositivos."
2024-10-12 18:12:12.155887,¿Qué opinan los usuarios sobre Amazon Music?,"Puedo ayudarte con el análisis de reseñas de productos en Amazon, proporcionando insights para mejorar la experiencia del cliente o el desarrollo de productos. ¿En qué área específica deseas que te ayude?

Para responder a la consulta sobre Amazon Music, analicemos las opiniones de los usuarios expresadas en las reseñas mencionadas:

- Los usuarios parecen estar satisfechos con la funcionalidad general de Amazon Music, especialmente en comparación con otros servicios similares.
- Se destaca que la aplicación tiene algunos errores o bugs que podrían afectar la experiencia del usuario.
- Algunos usuarios consideran que la interfaz no es muy amigable, lo que puede dificultar su uso.
- Existe una discrepancia en cuanto a la selección de música disponible, ya que algunos usuarios desearían una biblioteca más amplia sin tener que pagar extra por el servicio ilimitado.
- Se menciona una preocupación respecto a canciones y artistas que pueden volverse no disponibles con el tiempo, lo cual puede ser frustrante para los usuarios.

En conclusión, los usuarios tienen opiniones mixtas sobre Amazon Music. Aunque valoran aspectos como la calidad del servicio y la integración con otros productos de Amazon, también señalan áreas de mejora como la interfaz, la disponibilidad de contenido y posibles problemas técnicos. La variedad y estabilidad del catálogo musical son aspectos clave para muchos usuarios."
2024-10-12 18:12:39.110345,Dame opiniones sobre la usabilidad de McAfee,"Para analizar las opiniones sobre la usabilidad de McAfee en base a las reseñas proporcionadas, podemos identificar los siguientes puntos clave:

1. **Instalación y Activación**: 
   - Algunos usuarios mencionan que la instalación es fácil en Windows pero problemática en macOS.
   - Se reporta dificultad en activar la suscripción, lo que lleva a una experiencia negativa.

2. **Rendimiento y Velocidad**:
   - Usuarios experimentan lentitud en el inicio del programa, con tiempos de inicialización superiores a 5 minutos.
   - La lentitud percibida puede resultar frustrante para los usuarios acostumbrados a un rendimiento más rápido con otros programas similares.

3. **Protección y Efectividad**:
   - A pesar de su capacidad para detectar virus comunes, algunos usuarios mencionan que McAfee no bloquea eficazmente amenazas en macOS.
   - Se señala la presencia de adware y notificaciones constantes para comprar más suscripciones, lo que genera molestias y desconfianza en la efectividad del software.

4. **Experiencia General**:
   - Usuarios con experiencias previas con Norton destacan una transición negativa hacia McAfee debido a problemas de usabilidad y funcionalidad.
   - La falta de sincronización con cuentas existentes de Norton también se menciona como un inconveniente significativo.

En conclusión, las opiniones sobre la usabilidad de McAfee basadas en estas reseñas son mixtas, con aspectos positivos como detección de virus comunes a precios accesibles, pero fuertes críticas relacionadas con problemas de instalación, activación, rendimiento lento y molestias constantes por adware y notificaciones intrusivas. Estos factores pueden influir negativamente en la percepción general del producto por parte de los usuarios."
2024-10-12 18:12:48.687317,¿Cómo describen su experiencia con TurboTax?,Puedo ayudarte con el análisis de las reseñas de TurboTax en Amazon para proporcionarte insights sobre la experiencia de los usuarios con este software. ¿En qué aspecto específico te gustaría profundizar o qué información estás buscando sobre TurboTax?
2024-10-12 18:20:08.757871,¿Qué opinan los usuarios sobre Amazon Music?,"Puedo ayudarte con el análisis de reseñas de productos en Amazon, proporcionando insights para mejorar la experiencia del cliente o el desarrollo de productos. ¿En qué área específica deseas que te ayude? 

En cuanto a la opinión de los usuarios sobre Amazon Music basada en las reseñas proporcionadas, aquí hay un resumen:

- Los usuarios parecen estar contentos con la funcionalidad general de la aplicación, destacando que es buena y tiene pocos errores.
- Algunos mencionan que la interfaz no es muy amigable, lo que podría afectar la experiencia de uso.
- A pesar de estar satisfechos en general, hay críticas sobre la selección limitada de música disponible y el hecho de tener que pagar extra por el servicio ilimitado, incluso siendo miembros Prime.
- Se señala también que a lo largo del tiempo han experimentado problemas con canciones que descargaron previamente y luego se hicieron no disponibles en Amazon Music.

En conclusión, los usuarios tienen opiniones mixtas sobre Amazon Music. Mientras algunos están felices con la aplicación y su funcionamiento general, otros expresan preocupaciones sobre la selección limitada de música y los costos adicionales asociados al servicio ilimitado. La falta de algunas canciones descargadas anteriormente también ha sido un punto negativo para algunos usuarios. Es importante considerar estos aspectos al analizar las reseñas para identificar áreas de mejora y satisfacer las necesidades del mercado."
2024-10-12 18:20:21.217695,Dame opiniones sobre la usabilidad de McAfee,"Para evaluar la usabilidad de McAfee según las reseñas proporcionadas, podemos identificar varios aspectos clave mencionados por los usuarios:

- **Activación de la suscripción:** Varios usuarios reportan dificultades en activar la suscripción, lo que genera frustración y percepción de pérdida de tiempo.

- **Instalación en diferentes sistemas operativos:** Se destaca una diferencia significativa en la facilidad de instalación entre Windows y MacOS. Mientras que algunos usuarios mencionan que la instalación es fácil en Windows, otros experimentan problemas importantes en MacOS.

- **Protección contra virus comunes:** A pesar de algunas críticas, se reconoce que McAfee puede detectar y eliminar virus comunes de manera efectiva.

- **Problemas de adware y publicidad:** Algunos usuarios expresan molestia por recibir constantes notificaciones para comprar más suscripciones, lo cual perciben como un exceso de publicidad intrusiva.

- **Incompatibilidad con MacOS:** Varios usuarios señalan que McAfee no funciona correctamente en MacOS, bloqueando demasiadas funciones y generando inconvenientes en el uso diario.

- **Comparación con otras soluciones:** Se menciona la posibilidad de cambiar a Windows Defender u otras opciones provistas por proveedores de servicios de Internet debido a las deficiencias encontradas con McAfee.

En conclusión, basándonos en las reseñas analizadas, la usabilidad de McAfee parece presentar desafíos significativos para los usuarios. Las dificultades con la activación, instalación en MacOS y el exceso de publicidad pueden afectar negativamente la experiencia del usuario. Se sugiere considerar estas opiniones al evaluar la idoneidad de McAfee como solución antivirus."
