Timestamp,Question,Answer
2024-10-12 15:33:25.139295,¿Qué opinan los usuarios sobre Amazon Music?,"Puedo ayudarte con el análisis de reseñas de Amazon sobre Amazon Music. Según las opiniones de los usuarios proporcionadas:

- La aplicación es considerada buena, pero algunos mencionan que no es amigable.
- Se destaca la satisfacción general con la aplicación, aunque se desearía una mayor selección musical.
- Algunos usuarios expresan decepción por tener que pagar extra por música ilimitada, incluso siendo miembros Prime.
- Se menciona la falta de suficientes canciones y artistas, así como problemas con canciones descargadas que luego se vuelven no disponibles.

En conclusión, las opiniones sobre Amazon Music son mixtas. Mientras algunos usuarios están contentos con la aplicación y su funcionamiento, otros expresan preocupaciones sobre la selección musical, costos adicionales y disponibilidad de contenido. Es importante considerar estas perspectivas al evaluar la experiencia general de los usuarios con Amazon Music."
2024-10-12 15:33:32.419144,test,"Por favor, proporciona más detalles sobre el producto o aspecto que deseas analizar para ofrecerte una respuesta más precisa."
2024-10-12 15:34:27.292054,Dame opiniones sobre la usabilidad de McAfee,"Para evaluar la usabilidad de McAfee según las reseñas proporcionadas en Amazon, se observan opiniones mixtas. A continuación se presentan los puntos clave:

Aspecto: Usabilidad de McAfee
- Algunos usuarios expresan frustración con la activación y renovación del producto, mencionando dificultades y problemas con la suscripción.
- La instalación es descrita como sencilla en Windows, pero problemática en macOS, lo que puede afectar la experiencia del usuario en diferentes plataformas.
- Se destaca que McAfee parece ser efectivo para eliminar virus comunes y tiene un precio asequible, lo cual es un punto positivo.
- Sin embargo, varios usuarios reportan una mala experiencia debido a notificaciones frecuentes para comprar más suscripciones, lo que genera molestias y percepciones negativas sobre el software.
- Se menciona que McAfee parece funcionar mal en macOS al bloquear excesivamente funciones, lo que lleva a desinstalaciones y preferencias por otras soluciones antivirus.

En conclusión:
La usabilidad de McAfee según las reseñas es mixta. Si bien ofrece precios competitivos y efectividad contra virus comunes, los problemas de activación, renovación molesta de suscripciones y dificultades en macOS afectan la satisfacción del usuario. Se recomienda mejorar la experiencia de usuario en todas las plataformas y abordar las preocupaciones relacionadas con notificaciones intrusivas."
2024-10-12 15:34:42.850973,decias que la instalacion en windows es ?,"Puedo ayudarte con el análisis de reseñas de productos en Amazon, proporcionando insights para mejorar la experiencia del cliente o el desarrollo de productos. ¿En qué área específica deseas que te ayude?

Por favor, proporciona más detalles sobre el producto o aspecto que deseas analizar para ofrecerte una respuesta más precisa."
2024-10-12 15:35:02.720578,las ... enovación molesta de suscripciones y dificultades en macOS afectan?,"Puedo ayudarte con el análisis de reseñas de productos en Amazon, proporcionando insights para mejorar la experiencia del cliente o el desarrollo de productos. ¿En qué área específica deseas que te ayude?

Por favor, proporciona más detalles sobre el producto o aspecto que deseas analizar para ofrecerte una respuesta más precisa."
2024-10-12 15:35:13.779450,¿Cómo describen su experiencia con TurboTax?,"Para describir la experiencia con TurboTax basada en las reseñas proporcionadas, podemos observar varios aspectos clave:

- **Facilidad de Uso**: Los usuarios mencionan que TurboTax es fácil de usar tanto para impuestos federales como estatales. Esto indica una interfaz intuitiva y amigable para los usuarios durante el proceso de declaración de impuestos.

- **Actualizaciones y Soporte**: Se destaca que H&R Block ofrece actualizaciones periódicas para garantizar que los usuarios cuenten con la información más reciente. Además, el respaldo y compromiso del soporte técnico refuerzan la confianza de los usuarios en el software.

- **Problemas Técnicos**: Algunos usuarios experimentaron problemas técnicos al intentar actualizar TurboTax en sistemas Mac, lo que resultó en la necesidad de presentar las declaraciones por correo en lugar de hacerlo electrónicamente. Esta situación puede generar frustración y afectar la experiencia del usuario.

- **Inexactitudes en Cálculos**: Un usuario específico señala discrepancias significativas en los cálculos realizados por TurboTax 2021, lo que sugiere errores graves en las estimaciones fiscales. Esta falta de precisión puede impactar negativamente la confianza de los usuarios en el software.

- **Capacidad Predictiva Limitada**: Se menciona que la capacidad de TurboTax para predecir impuestos futuros (como los correspondientes a 2021) parece ser deficiente debido a inexactitudes en los cálculos y a no considerar adecuadamente ciertos tipos de ingresos, lo cual puede ser una limitación importante para algunos usuarios.

En conclusión, las reseñas sobre TurboTax revelan una combinación de puntos positivos, como facilidad de uso y actualizaciones frecuentes, junto con desafíos relacionados con problemas técnicos, inexactitudes en cálculos y limitaciones en su capacidad predictiva. Estos aspectos pueden influir significativamente en la percepción general de los usuarios sobre la efectividad y confiabilidad del software."
2024-10-12 15:35:26.681941,hablame de la  Inexactitudes en Cálculos:,"Puedo ayudarte con el análisis de reseñas de productos en Amazon, proporcionando insights para mejorar la experiencia del cliente o el desarrollo de productos. ¿En qué área específica deseas que te ayude?

Por favor, proporciona más detalles sobre el producto o aspecto que deseas analizar para ofrecerte una respuesta más precisa."
2024-10-12 15:46:10.727126,etrrr,"Puedo ayudarte con el análisis de reseñas de productos en Amazon, proporcionando insights para mejorar la experiencia del cliente o el desarrollo de productos. ¿En qué área específica deseas que te ayude?"
2024-10-12 15:46:26.335583,tienes conclusiones?,Puedo ayudarte con el análisis de las reseñas proporcionadas. ¿Podrías brindarme más información sobre el producto del que se están analizando las reseñas y cuáles son los objetivos específicos que deseas alcanzar con este análisis?
2024-10-12 15:46:44.255480,dime la opinion de los usuarios de Photoshop,"Puedo ayudarte con el análisis de reseñas de productos en Amazon, proporcionando insights para mejorar la experiencia del cliente o el desarrollo de productos. ¿En qué área específica deseas que te ayude?

Por favor, proporciona más detalles sobre el producto o aspecto que deseas analizar para ofrecerte una respuesta más precisa."
2024-10-12 15:47:00.126263,dime la opinion de los usuarios de Photoshop,"Puedo ayudarte con el análisis de reseñas de productos en Amazon, proporcionando insights para mejorar la experiencia del cliente o el desarrollo de productos. ¿En qué área específica deseas que te ayude?

Por favor, proporciona más detalles sobre el producto o aspecto que deseas analizar para ofrecerte una respuesta más precisa."
2024-10-12 15:47:33.406986,¿Qué piensan los usuarios sobre la usabilidad del software McAfee Internet Security?,"Para analizar la usabilidad del software McAfee Internet Security según las reseñas proporcionadas, podemos identificar varios puntos clave:

1. **Facilidad de Instalación**: 
   - Los usuarios mencionan que la instalación es fácil en Windows pero terrible en MacOS. Esto puede indicar una disparidad en la experiencia de usuario entre los diferentes sistemas operativos.

2. **Problemas de Activación y Suscripción**:
   - Varios usuarios reportan dificultades con la activación de la suscripción, incluyendo problemas con el CD y la expiración prematura del servicio. Estos inconvenientes afectan directamente la experiencia del cliente.

3. **Protección Efectiva vs. Intrusividad**:
   - Aunque algunos usuarios destacan que el software elimina virus comunes de manera efectiva y tiene un precio asequible, otros mencionan problemas con notificaciones constantes para comprar más suscripciones y molestias relacionadas con adware.

4. **Rendimiento en Diferentes Plataformas**:
   - Se observa una discrepancia en el rendimiento del software entre Windows y MacOS, donde algunos usuarios optan por desinstalarlo en MacOS debido a bloqueos excesivos y problemas de funcionamiento.

5. **Actualizaciones Automáticas**:
   - Usuarios informan sobre dificultades para que el software se actualice automáticamente, lo que genera preocupaciones sobre si McAfee Internet Security realmente protege adecuadamente los dispositivos si no se actualiza correctamente.

En conclusión, las opiniones sobre la usabilidad del software McAfee Internet Security son mixtas y revelan desafíos significativos en términos de instalación, activación de suscripciones, intrusividad de notificaciones comerciales, rendimiento variable en distintas plataformas y problemas con las actualizaciones automáticas. Esta diversidad de experiencias sugiere que mejorar la consistencia del servicio y abordar las deficiencias mencionadas podría ser crucial para aumentar la satisfacción del usuario y fortalecer la posición competitiva del producto en el mercado.

Diagnóstico de polaridad: Las opiniones presentadas muestran una polaridad negativa generalizada hacia McAfee Internet Security debido a diversos problemas experimentados por los usuarios."
2024-10-12 15:47:44.567441,Dame opiniones sobre la usabilidad de McAfee,"Para evaluar la usabilidad de McAfee basándonos en las reseñas proporcionadas, encontramos opiniones mixtas:

Aspecto: Usabilidad de McAfee
- Un usuario menciona que la activación de la suscripción fue un fracaso y que el software parece bloquear todo en macOS, lo cual resulta frustrante.
- Otro usuario destaca que la instalación es sencilla en Windows pero terrible en macOS, además de experimentar problemas con notificaciones persistentes para comprar más suscripciones.
- Sin embargo, hay comentarios positivos sobre su capacidad para detectar virus comunes y su precio asequible.

En conclusión:
La usabilidad de McAfee parece variar según el sistema operativo utilizado. Mientras algunos usuarios encuentran problemas significativos con la activación, notificaciones intrusivas y bloqueos excesivos en macOS, otros valoran su capacidad para detectar virus comunes y su accesibilidad económica. Se recomienda considerar estas diferencias al elegir un antivirus. 

Diagnóstico de polaridad: 
Las opiniones sobre la usabilidad de McAfee son mayormente negativas, destacando dificultades en la activación, notificaciones molestas y problemas específicos en macOS."
2024-10-12 15:48:36.483310,3.	¿Qué desafíos han enfrentado los usuarios al instalar el software antivirus Norton en sus PCs?,"Los usuarios han enfrentado varios desafíos al instalar el software antivirus Norton en sus PCs, según las reseñas analizadas:

- Instalación complicada y difícil tanto en Windows como en MacOS.
- Problemas de sincronización con cuentas Norton existentes.
- Dificultades para activar la suscripción, incluso con el CD proporcionado.
- Experiencia poco amigable y problemas de usabilidad con las descargas de Norton.
- Reportes frecuentes de adware y solicitudes constantes para comprar más suscripciones.
- Bloqueo excesivo de funciones en MacOS, lo que lleva a desinstalaciones y búsqueda de alternativas como Windows Defender.

En resumen, los principales desafíos que han enfrentado los usuarios al instalar el software antivirus Norton incluyen problemas de instalación, activación, usabilidad, adware intrusivo y bloqueo excesivo en MacOS. Estos aspectos han llevado a algunos usuarios a optar por soluciones alternativas. 

Diagnóstico de polaridad: Las opiniones expresadas son mayoritariamente negativas debido a los múltiples problemas experimentados por los usuarios al utilizar el software antivirus Norton."
2024-10-12 15:48:51.023424,14.	¿Qué problemas encuentran los usuarios con el proceso de instalación de VideoStudio?,"Para analizar los problemas que encuentran los usuarios con el proceso de instalación de VideoStudio, es importante destacar las siguientes dificultades mencionadas en la reseña:

1. Los usuarios experimentan problemas al intentar abrir el programa incluso después de instalarlo y desinstalarlo dos veces.
2. Se menciona que anteriormente utilizaban Nero 8 con facilidad para importar archivos, editar videos y grabar en DVD, pero con Nero 11 han surgido varios inconvenientes.
3. Con Nero 11, se reporta la imposibilidad de importar videos tomados con cámaras específicas como Panasonic Lumix DMC FZ100, Pentax X-5 y Nikon Coolpix P80.
4. Se destaca que la edición de archivos se ha vuelto complicada, especialmente al dividirlos o cortarlos, además de la dificultad para eliminar videos no deseados.
5. No es posible realizar acciones como insertar logos o utilizar Picture-in-Picture (PIP) como en otros programas como CyberLink o Corel VideoStudio Pro X2.
6. Se menciona una lentitud en el proceso de grabación y la imposibilidad de indicar el número de copias a realizar con Nero Recode.

En resumen, los usuarios encuentran problemas significativos durante el proceso de instalación y uso del software VideoStudio, incluyendo dificultades para importar ciertos tipos de archivos, limitaciones en las funciones de edición y grabación, así como comparaciones desfavorables con otras herramientas disponibles en el mercado.

Diagnóstico de polaridad: 
Las opiniones expresadas muestran principalmente una percepción negativa hacia VideoStudio debido a las numerosas dificultades encontradas por los usuarios en su experiencia con el programa."
2024-10-12 15:49:15.084489,7.	How do users rate the security features of McAfee software in protecting their systems?,"Puedo ayudarte con el análisis de reseñas de productos en Amazon, proporcionando insights para mejorar la experiencia del cliente o el desarrollo de productos. ¿En qué área específica deseas que te ayude?"
2024-10-12 15:49:26.044727,6.	Was sagen die Benutzer über die Zuverlässigkeit der VideoStudio-Software über verschiedene Versionen hinweg?,"Puedo ayudarte con el análisis de reseñas de productos en Amazon, proporcionando insights para mejorar la experiencia del cliente o el desarrollo de productos. ¿En qué área específica deseas que te ayude? 

Por favor, proporciona más detalles sobre la VideoStudio-Software y las versiones específicas que te interesan para poder ofrecerte una respuesta precisa sobre la confiabilidad según las opiniones de los usuarios."
2024-10-12 15:50:03.109887,6.	¿Qué dicen los usuarios sobre la fiabilidad del software VideoStudio a lo largo de diferentes versiones?,"Para analizar la fiabilidad del software VideoStudio a lo largo de diferentes versiones, es importante revisar las reseñas y opiniones de los usuarios en Amazon. A continuación, se presentan algunos insights basados en las reseñas proporcionadas:

En la opinión sobre Nero 11, un usuario menciona que el programa presenta problemas al importar videos de varias cámaras digitales, dificultando la edición y eliminación de contenido no deseado. También destaca que el proceso de grabación es más lento y limitado en cuanto a indicar el número de copias.

Por otro lado, un usuario comenta que tuvo dificultades al instalar el software VHS2DVD Wizard, experimentando problemas con la captura de video y audio distorsionado. Además, menciona que el software se congela y se bloquea después de grabar una cinta VHS completa.

En una reseña sobre otra aplicación no especificada, un usuario otorga tres estrellas debido a que al instalarla en su PC, esta se convierte en una computadora dedicada exclusivamente a copiar DVDs, lo cual limita su funcionalidad para otros propósitos.

Aunque las reseñas proporcionadas son variadas en cuanto a los problemas específicos experimentados por los usuarios con diferentes versiones de software de edición y grabación de video, podemos concluir lo siguiente:

En conclusión:
- La fiabilidad del software VideoStudio parece ser cuestionable según algunas reseñas. Los usuarios han experimentado dificultades con la importación de videos, problemas técnicos durante la captura y edición, así como limitaciones inesperadas en la funcionalidad del software.
- Es recomendable considerar otras opciones en el mercado antes de adquirir este producto específico para garantizar una experiencia satisfactoria y evitar posibles inconvenientes relacionados con su uso.
- Se sugiere realizar una investigación más detallada sobre las capacidades y limitaciones específicas de cada versión del software VideoStudio antes de realizar una compra.

Diagnóstico de polaridad: 
Las opiniones expresadas muestran principalmente aspectos negativos y desafíos encontrados por los usuarios al utilizar diferentes versiones del software mencionado."
2024-10-12 15:50:18.016837,1.	How do users describe their experience using TurboTax software over the last 10 years?,"Los usuarios describen su experiencia utilizando el software TurboTax durante los últimos 10 años de la siguiente manera:

- Algunos usuarios han expresado que TurboTax ha sido fácil de usar para completar sus impuestos federales y estatales a lo largo de los años.
- Se destaca la capacidad del software para guiar a los usuarios a través de los pasos necesarios para maximizar los beneficios fiscales del año.
- Otros usuarios mencionan que aprecian las actualizaciones proporcionadas por TurboTax a medida que están disponibles, lo que les brinda confianza en la precisión de sus declaraciones.
- Sin embargo, también se han reportado experiencias negativas, como problemas técnicos al actualizar el software en ciertos sistemas operativos, lo que resultó en la necesidad de presentar las declaraciones por correo en lugar de electrónicamente.

En resumen, la mayoría de los usuarios valoran positivamente la facilidad de uso y la orientación proporcionada por TurboTax a lo largo del tiempo. Aunque existen algunas críticas relacionadas con fallos técnicos y actualizaciones, en general, se percibe como una herramienta útil para completar las declaraciones fiscales."
2024-10-12 15:50:31.575242,20.	Was sagen die Benutzer über die Qualität der Updates für die Norton-Antivirensoftware?,"No tengo suficiente información para responder a esta pregunta. Por favor, proporcione más detalles sobre la calidad de las actualizaciones para el software antivirus Norton según las reseñas analizadas en Amazon."
2024-10-12 15:50:45.603281,20.	What do users say about the quality of updates for Norton antivirus software?,"Los usuarios tienen opiniones mixtas sobre la calidad de las actualizaciones del software antivirus Norton. Algunos mencionan que han confiado en los productos de Norton durante años y que las actualizaciones son simples, suaves y ahorran tiempo. Otros usuarios expresan insatisfacción, calificando a Norton como engañoso y un desperdicio de dinero, mencionando dificultades en la instalación, falta de sincronización en las cuentas de Norton y una experiencia general poco amigable para el usuario.

En conclusión, las opiniones sobre la calidad de las actualizaciones para el software antivirus Norton son variadas, con algunos usuarios satisfechos por la simplicidad y eficacia, mientras que otros muestran descontento por problemas de instalación y usabilidad."
2024-10-12 15:51:24.617755,16.	¿Cómo perciben los usuarios la efectividad de Photoshop en uso profesional?,"Puedo ayudarte con el análisis de reseñas de productos en Amazon, proporcionando insights para mejorar la experiencia del cliente o el desarrollo de productos. ¿En qué área específica deseas que te ayude?

Por favor, proporciona más detalles sobre el producto o aspecto que deseas analizar para ofrecerte una respuesta más precisa."
2024-10-12 15:52:41.009304,6.	Was sagen die Benutzer über die Zuverlässigkeit der VideoStudio-Software über verschiedene Versionen hinweg?,"Para responder a la pregunta ""Was sagen die Benutzer über die Zuverlässigkeit der VideoStudio-Software über verschiedene Versionen hinweg?"" analizaré las reseñas relevantes del producto VideoStudio en Amazon.

En el corpus de reseñas proporcionado, se mencionan algunas opiniones sobre la fiabilidad de diferentes versiones de la software VideoStudio:

1. Algunos usuarios expresan que les encanta la aplicación, pero otorgan solo tres estrellas debido a problemas específicos, como la limitación de la función 4K Ultra HD. Esto podría indicar cierta insatisfacción con respecto a las características más avanzadas de la software.

2. Otros comentarios señalan dificultades durante la instalación y el uso de versiones anteriores, como problemas con los controladores y requisitos del sistema operativo. Estos aspectos podrían afectar directamente la percepción de confiabilidad de la software a lo largo de las versiones.

3. Un usuario menciona haber experimentado limitaciones inesperadas al instalar una versión específica en su computadora, lo que resultó en una funcionalidad restringida solo para copiar DVDs. Esta restricción puede influir negativamente en la percepción general de confiabilidad y versatilidad del software.

En conclusión, basándonos en las reseñas analizadas, los usuarios han expresado diversas experiencias con diferentes versiones de VideoStudio en términos de confiabilidad. Algunas críticas apuntan a problemas técnicos y limitaciones funcionales que podrían impactar su percepción sobre la fiabilidad del software a lo largo de las distintas versiones. Es importante considerar estas opiniones al evaluar la consistencia y calidad del producto a lo largo del tiempo."
2024-10-12 15:57:39.369668,4.	Wie fühlen sich die Benutzer über die Funktionen von Amazon Prime Music bei der Verwendung auf einem PC?,"Entiendo que estás buscando información sobre cómo se sienten los usuarios acerca de las funciones de Amazon Prime Music al usarlo en una PC. Para analizar esta situación, primero debemos considerar las reseñas proporcionadas en el contexto.

1. **Amazon Prime Music en PC:**
   - Los usuarios mencionan que disfrutan de todo lo que ofrece la membresía de Amazon Prime.
   - Se describe como un servicio intermedio con poco contenido en el paquete base.
   - Algunos usuarios advierten que la descarga desde BR (Brasil) a través de Amazon Prime aparentemente gratuita termina cobrando 6,56.
   - Existen comentarios negativos sobre su compatibilidad con Amazon Prime y Netflix, siendo esta última una razón importante para adquirir este VPN.

En resumen, las opiniones sobre Amazon Prime Music varían desde aspectos positivos hasta críticas sobre su contenido y funcionalidad con otros servicios como Netflix. Parece haber discrepancias en cuanto a la experiencia general de uso.

**Diagnóstico de Polaridad:** Las opiniones son mixtas, con algunos usuarios expresando satisfacción por la oferta de Amazon Prime mientras que otros muestran descontento por diversos problemas relacionados con la suscripción y la compatibilidad con otros servicios."
2024-10-12 15:57:58.491735,"17.	Was mögen Benutzer am meisten daran, Amazon Prime Music täglich zu verwenden?","Puedo ayudarte con el análisis de reseñas de productos en Amazon, proporcionando insights para mejorar la experiencia del cliente o el desarrollo de productos. ¿En qué área específica deseas que te ayude?"
2024-10-12 15:58:19.812707,"10.	Welche positiven Aspekte heben Benutzer hervor, wenn sie Photoshop für Grafikdesign verwenden?","Puedo ayudarte con el análisis de reseñas de productos en Amazon, proporcionando insights para mejorar la experiencia del cliente o el desarrollo de productos. ¿En qué área específica deseas que te ayude?"
2024-10-12 15:58:55.111596,working with photoshop for years,"Puedo ayudarte con el análisis de reseñas de productos en Amazon, proporcionando insights para mejorar la experiencia del cliente o el desarrollo de productos. ¿En qué área específica deseas que te ayude?

Por favor, proporciona más detalles sobre el producto o aspecto que deseas analizar para ofrecerte una respuesta más precisa."
2024-10-12 16:02:23.058182,no tienes ningun dato de photoshop?,"Puedo ayudarte con el análisis de reseñas de productos en Amazon, proporcionando insights para mejorar la experiencia del cliente o el desarrollo de productos. ¿En qué área específica deseas que te ayude?"
