Timestamp,Question,Answer
2024-10-12 16:04:28.289074,10.	What positive aspects do users highlight about using Photoshop for graphic design?,"Los usuarios destacan varios aspectos positivos al utilizar Photoshop para diseño gráfico:

- Facilidad de uso: Los usuarios mencionan que el programa es fácil de usar y les permite realizar ediciones en sus fotos de manera rápida y eficiente.

- Velocidad: Se destaca la rapidez con la que se pueden realizar las ediciones, ya que no es necesario estar abriendo y guardando constantemente los archivos.

- Copia de ajustes: La capacidad de copiar ajustes de una foto a otra es valorada positivamente por los usuarios, ya que facilita el proceso de edición y mantiene consistencia en el estilo visual.

- Diseño bien pensado: Los usuarios resaltan la calidad del diseño del programa y cómo está estructurado, lo que facilita su uso una vez se comprende su funcionamiento.

En conclusión, los usuarios aprecian la facilidad de uso, la velocidad, la funcionalidad para copiar ajustes y el diseño bien pensado al utilizar Photoshop para diseño gráfico."
2024-10-12 16:05:30.493363,dime que sabes de Photoshop,"No tengo suficiente información para responder a esta pregunta. Por favor, proporciona más detalles."
2024-10-12 16:05:44.674241,¿Qué opinan los usuarios sobre Amazon Music?,"Puedo ayudarte con el análisis de reseñas de Amazon sobre Amazon Music. Basándome en las reseñas proporcionadas, aquí tienes un resumen de lo que opinan los usuarios:

- Los usuarios mencionan que las aplicaciones de Amazon funcionan bien en Brasil, pero hay problemas con Prime Music que constantemente pide membresía y bloquea contenido Prime.
- A pesar de algunos bugs, se destaca que la aplicación es buena pero no muy amigable.
- Algunos usuarios expresan satisfacción general con la aplicación, aunque les gustaría una selección musical más amplia sin tener que pagar extra por música ilimitada.
- Se señala una preocupación sobre la cantidad limitada de canciones y artistas, así como la frustración cuando algunas canciones descargadas se vuelven no disponibles con el tiempo.

En conclusión, los usuarios tienen opiniones mixtas sobre Amazon Music. Mientras algunos están contentos con la aplicación en general, otros expresan frustraciones relacionadas con la membresía, la selección musical y la disponibilidad de canciones. 

Diagnóstico de polaridad: La percepción general parece ser neutral a ligeramente positiva, con algunas críticas específicas sobre ciertos aspectos del servicio."
2024-10-12 17:07:41.448280,10.	What positive aspects do users highlight about using Photoshop for graphic design?,"Los usuarios destacan varios aspectos positivos al utilizar Photoshop para diseño gráfico:

- Facilidad de uso: Los usuarios mencionan que el programa les resulta fácil de usar, lo que les permite realizar tareas de edición de fotos de manera eficiente.

- Velocidad: Se destaca la rapidez con la que se puede trabajar en Photoshop, ya que no es necesario abrir y guardar constantemente los archivos, lo cual ahorra tiempo.

- Copiar ajustes entre fotos: Se menciona que es sencillo copiar ajustes de una foto a otra, lo que facilita el proceso de edición cuando se trabaja con múltiples imágenes.

En conclusión, los usuarios valoran la facilidad de uso, la velocidad y la capacidad de copiar ajustes entre fotos al utilizar Photoshop para diseño gráfico."
2024-10-12 17:07:55.042071,"10.	Welche positiven Aspekte heben Benutzer hervor, wenn sie Photoshop für Grafikdesign verwenden?","Puedo ayudarte con el análisis de reseñas de productos en Amazon, proporcionando insights para mejorar la experiencia del cliente o el desarrollo de productos. ¿En qué área específica deseas que te ayude?"
2024-10-12 17:08:03.540555,"10.	Welche positiven Aspekte heben Benutzer hervor, wenn sie Photoshop für Grafikdesign verwenden?","Puedo ayudarte con el análisis de reseñas de productos en Amazon, proporcionando insights para mejorar la experiencia del cliente o el desarrollo de productos. ¿En qué área específica deseas que te ayude?"
2024-10-12 17:08:12.943436,"Welche positiven Aspekte heben Benutzer hervor, wenn sie Photoshop für Grafikdesign verwenden?","En este caso, las reseñas destacan los siguientes aspectos positivos al utilizar Photoshop para el diseño gráfico:

- Facilidad de uso: Los usuarios mencionan que el programa es fácil de usar y les permite realizar ediciones en sus fotos de manera rápida y eficiente.
- Herramientas completas: Se destaca que Photoshop proporciona todas las herramientas necesarias para lograr los resultados deseados en la fotografía, tanto para retoques generales como para ajustes más detallados.
- Automatización de tareas: Algunos usuarios valoran la capacidad del programa para realizar ajustes automáticos al momento de cargar una imagen, lo cual agiliza el proceso de edición y luego permite afinar los detalles según las preferencias individuales.

En resumen, los usuarios elogian la accesibilidad, versatilidad y eficiencia de Photoshop en cuanto a su capacidad para satisfacer las necesidades de diseño gráfico y retoque fotográfico."
2024-10-12 17:08:30.099110,Was sind die Meinungen der Benutzer zur Kosteneffektivität der Verwendung der TurboTax-Software?,"Para analizar las opiniones de los usuarios sobre la costeefectividad de la utilización de la software TurboTax, primero revisaremos las reseñas proporcionadas en el contexto.

1. **TurboTax en Mac**:
- Aspecto: Actualización y funcionamiento en Mac.
- Opinión 1: El usuario experimentó dificultades al intentar actualizar el software TurboTax en su Mac, lo que resultó en la necesidad de enviar por correo las formas en lugar de presentar electrónicamente. Esto va en contra de las iniciativas del IRS para fomentar la presentación electrónica.
- Opinión 2: Otra persona menciona que no pudo actualizar el software desde el sitio de TurboTax y recibió un reembolso completo de Amazon.

2. **Capacidad predictiva para impuestos actuales**:
- Aspecto: Capacidad predictiva para impuestos actuales.
- Opinión: Un usuario destaca su interés en predecir los impuestos del año actual usando TurboTax 2021, pero encuentra que las estimaciones son considerablemente inexactas y problemáticas, especialmente con ingresos por intereses y ganancias de capital mal calculados.

3. **H&R Block Software**:
- Aspecto: Comparación con H&R Block Software.
- Opinión: Un usuario elogia la facilidad de uso y eficacia del software H&R Block durante los últimos tres períodos fiscales, destacando las actualizaciones oportunas y el respaldo del producto.

En conclusión:
Basándonos en las reseñas proporcionadas, se observa una discrepancia significativa en la efectividad percibida entre TurboTax y H&R Block Software. Mientras algunos usuarios experimentaron problemas con TurboTax, otros encontraron satisfacción con H&R Block. Es importante considerar estas opiniones al evaluar la costeefectividad de utilizar la software TurboTax.

Polaridad general de opiniones:
Las opiniones sobre TurboTax varían desde críticas negativas hasta comentarios positivos limitados a versiones anteriores del software. Existe una clara tendencia hacia críticas relacionadas con problemas técnicos y cálculos erróneos en la versión actual (TurboTax 2021)."
2024-10-12 17:08:52.485368,Wie nehmen Benutzer die Effektivität von Photoshop im professionellen Einsatz wahr?,"Puedo ayudarte con el análisis de reseñas de productos en Amazon, proporcionando insights para mejorar la experiencia del cliente o el desarrollo de productos. ¿En qué área específica deseas que te ayude?

Por favor, proporciona más detalles sobre el producto o aspecto que deseas analizar para ofrecerte una respuesta más precisa."
2024-10-12 17:09:05.182886,"Was mögen Benutzer am meisten daran, Amazon Prime Music täglich zu verwenden?","Puedo ayudarte con el análisis de reseñas de productos en Amazon, proporcionando insights para mejorar la experiencia del cliente o el desarrollo de productos. ¿En qué área específica deseas que te ayude?"
2024-10-12 17:09:17.161221,What do users like most about using Amazon Prime Music on a daily basis?,"Puedo ayudarte con el análisis de reseñas de productos en Amazon, proporcionando insights para mejorar la experiencia del cliente o el desarrollo de productos. ¿En qué área específica deseas que te ayude?

Por favor, proporciona más detalles sobre el producto o aspecto que deseas analizar para ofrecerte una respuesta más precisa."
2024-10-12 17:09:29.864709,17.	¿Qué es lo que más les gusta a los usuarios de usar Amazon Prime Music a diario?,"Puedo ayudarte con el análisis de reseñas de productos en Amazon, proporcionando insights para mejorar la experiencia del cliente o el desarrollo de productos. ¿En qué área específica deseas que te ayude?

Por favor, proporciona más detalles sobre el producto o aspecto que deseas analizar para ofrecerte una respuesta más precisa."
2024-10-12 17:09:45.935766,10.	¿Qué aspectos positivos destacan los usuarios al usar Photoshop para diseño gráfico?,"Para analizar las reseñas y destacar los aspectos positivos de los usuarios al usar Photoshop para diseño gráfico, primero debemos revisar detenidamente las opiniones proporcionadas en el contexto. A continuación, presentaré un resumen de los comentarios relevantes:

En primer lugar, un usuario menciona que le encanta el programa y destaca que hace que Photoshop sea casi innecesario para muchas de sus fotos. Además, resalta la rapidez del programa al no tener que abrir y guardar constantemente, lo cual facilita copiar ajustes de una foto a otra.

Por otro lado, se menciona que el programa realiza algunas funciones adecuadamente. Sin embargo, se critica fuertemente la interfaz de usuario en esta versión específica. El usuario expresa que todo parece estar diseñado para trabajar con una sola cosa a la vez, lo cual dificulta repetir acciones mediante teclado o ratón.

En resumen, los aspectos positivos destacados por los usuarios al utilizar este programa para diseño gráfico incluyen su eficacia en la edición de fotos, la rapidez en el proceso y la facilidad para copiar ajustes entre imágenes.

Diagnóstico de polaridad:
- En general, las opiniones son mixtas con una ligera tendencia negativa debido a problemas con la interfaz y falta de respuesta por parte del soporte técnico.
"
2024-10-12 17:10:24.072257,¿Qué piensan los usuarios sobre la usabilidad del software McAfee Internet Security?,"Para analizar las opiniones de los usuarios sobre la usabilidad del software McAfee Internet Security, es importante destacar algunos puntos clave identificados en las reseñas:

- Facilidad de instalación: Los usuarios mencionan que la instalación es fácil en Windows, pero problemática en macOS. Algunos indican que se requiere crédito para la activación, lo cual genera inconvenientes.

- Problemas de activación y renovación: Se reportan dificultades con la activación y renovación de suscripciones, lo que lleva a una percepción negativa de la experiencia de uso.

- Rendimiento en macOS: Varios usuarios comentan que el software no funciona bien en macOS, bloqueando funciones y generando molestias al usuario.

- Actualizaciones automáticas: A pesar de tener configuradas las actualizaciones automáticas, algunos usuarios señalan que el software no se actualiza correctamente, lo que pone en duda su efectividad para proteger el sistema.

- Experiencia general insatisfactoria: La mayoría de las reseñas expresan frustración con McAfee Internet Security debido a problemas recurrentes como adware intrusivo, solicitudes constantes de compra adicional y fallos en la protección del dispositivo.

En conclusión, los usuarios muestran una percepción mayormente negativa sobre la usabilidad del software McAfee Internet Security. Se destacan problemas significativos relacionados con la activación, renovación de suscripciones, rendimiento en macOS y actualizaciones automáticas. Estas opiniones reflejan una experiencia insatisfactoria para muchos usuarios, lo cual puede impactar negativamente en su confianza en el producto y su decisión de seguir utilizándolo."
2024-10-12 17:10:52.933246,¿Qué tan efectiva consideran los usuarios la protección de McAfee Internet Security frente a amenazas específicas como ransomware y spyware?,"Para evaluar la efectividad de McAfee Internet Security frente a amenazas específicas como ransomware y spyware, analicemos las reseñas proporcionadas:

1. **Usuario 1**: Describe que el software McAfee no funciona bien en macOS y menciona problemas recurrentes con adware y suscripciones adicionales. Concluye cambiando a otra solución de seguridad.

2. **Usuario 2**: Comenta que compró el producto esperando protección para dispositivos móviles, pero solo ofrece funciones antirrobo y copia de seguridad de contactos, no protección contra spyware y malware como se promociona.

3. **Usuario 3**: Experimentó dificultades al activar la suscripción del producto desde el CD recibido, lo que lleva a considerar la compra como una pérdida total.

4. **Usuario 4**: Señala que en su laptop con Windows 7, McAfee tarda mucho en cargar, no se actualiza automáticamente como debería y constantemente muestra vulnerabilidades sin corregirlas, generando dudas sobre si realmente está protegiendo su sistema.

En conclusión:
- Los usuarios expresan insatisfacción con McAfee Internet Security debido a problemas de funcionalidad, activación de suscripciones y falta de cumplimiento con las promesas de protección contra amenazas.
- Existe una percepción generalizada de ineficacia en la detección y prevención de ransomware y spyware por parte del software McAfee según las experiencias compartidas en las reseñas.
- La tendencia apunta hacia una baja confianza en la capacidad del producto para brindar una defensa sólida contra estas amenazas específicas.

Diagnóstico de polaridad: Las opiniones presentadas reflejan principalmente sentimientos negativos hacia la efectividad de McAfee Internet Security en la protección contra ransomware y spyware."
2024-10-12 17:11:44.304482,对TurboTax的体验如何描述,"Para analizar la experiencia de los usuarios con TurboTax basado en las reseñas proporcionadas, podemos identificar varios puntos clave:

1. **Facilidad de uso y actualizaciones**: Los usuarios mencionan que TurboTax fue fácil de usar para impuestos federales y estatales, pero tuvieron problemas al intentar actualizar el software en un Mac con OS X 10.3. Esto generó dificultades para completar el proceso, ya que no pudieron presentar electrónicamente debido a fallos en las actualizaciones.

2. **Precisión en cálculos y funcionalidades**: Un usuario expresó su descontento con la versión de TurboTax 2021 al intentar predecir los impuestos del año en curso. Señaló que las predicciones eran inexactas, especialmente en cuanto a ingresos por intereses e impuestos sobre ganancias de capital, lo cual resultó en cálculos erróneos.

3. **Comparación con H&R Block**: Otro usuario destacó su satisfacción con el software de H&R Block durante los últimos tres periodos fiscales, resaltando su facilidad de uso, actualizaciones oportunas y respaldo del servicio al cliente.

En conclusión:
- Los usuarios experimentaron dificultades con la actualización del software TurboTax en Mac y encontraron problemas de precisión en los cálculos fiscales para el año 2021.
- A pesar de las críticas hacia TurboTax 2021, se reconoce que versiones anteriores han sido útiles para calcular impuestos pasados.
- H&R Block fue mencionado como una alternativa satisfactoria por parte de un usuario.

En cuanto a la polaridad de las opiniones:
- Las reseñas reflejan principalmente una percepción negativa hacia la experiencia con TurboTax 2021 debido a problemas técnicos y errores en los cálculos.
- Por otro lado, H&R Block recibió comentarios positivos por su usabilidad y soporte.

Este análisis destaca la importancia tanto de la funcionalidad técnica como de la precisión en los cálculos para mejorar la satisfacción del usuario en plataformas fiscales como TurboTax."
2024-10-12 17:12:05.912385,"Amazon Prime Music no puede competir con Spotify en cuanto a la calidad de sonido, ¿cómo justifican los usuarios seguir usándolo?","Puedo ayudarte con el análisis de reseñas de productos en Amazon, proporcionando insights para mejorar la experiencia del cliente o el desarrollo de productos. ¿En qué área específica deseas que te ayude?"
2024-10-12 17:12:15.944268,"Amazon Prime Music no puede competir con Spotify en cuanto a la calidad de sonido, ¿cómo justifican los usuarios seguir usándolo?","Puedo ayudarte con el análisis de reseñas de productos en Amazon, proporcionando insights para mejorar la experiencia del cliente o el desarrollo de productos. ¿En qué área específica deseas que te ayude?"
2024-10-12 17:12:35.332748,¿Es mejor para los usuarios con creencias políticas conservadoras evitar el uso de plataformas de software respaldadas por empresas con políticas liberales?,"Puedo ayudarte con el análisis de reseñas de productos en Amazon, proporcionando insights para mejorar la experiencia del cliente o el desarrollo de productos. ¿En qué área específica deseas que te ayude?"
2024-10-12 17:20:42.133338,¿Es mejor para los usuarios con creencias políticas conservadoras evitar el uso de plataformas de software respaldadas por empresas con políticas liberales?,"Basándome en las reseñas proporcionadas, no hay una indicación clara de que los usuarios con creencias políticas conservadoras deban evitar el uso de plataformas de software respaldadas por empresas con políticas liberales. A continuación, presento un análisis detallado de las reseñas para ofrecer una perspectiva fundamentada:

1. El primer usuario menciona haber adquirido una suite de oficina para trabajar sin conexión a internet, pero se siente frustrado porque la aplicación requiere una conexión wifi cercana para funcionar. Esta experiencia no está directamente relacionada con creencias políticas.

2. En otra reseña, se destaca la preferencia por Microsoft Office en un entorno escolar, sin mencionar aspectos políticos. La recomendación se basa en la utilidad del software para enseñar a estudiantes.

3. Un usuario expresa su decepción al descubrir que el software no incluye una descarga específica para Texas al realizar sus impuestos. Esta crítica se centra en la funcionalidad del programa y no en consideraciones políticas.

4. Finalmente, un usuario menciona su preferencia por productos Mac pero reconoce la necesidad de utilizar Microsoft Office para acceder a ciertos archivos académicos. No se abordan opiniones políticas en esta revisión.

En conclusión, según las reseñas analizadas, no existe una correlación directa entre las creencias políticas conservadoras y la elección de plataformas de software respaldadas por empresas con políticas liberales. Las opiniones expresadas se enfocan principalmente en la funcionalidad y utilidad del software en lugar de consideraciones políticas."
2024-10-12 17:21:06.601677,en que me puedes ayudar?,"Basándome en las reseñas proporcionadas, puedo ayudarte a analizar la experiencia de los usuarios con un programa que parece ser de aprendizaje de idiomas. Aquí hay algunos insights basados en las opiniones expresadas:

1. **Dificultad de uso**: Según una reseña, el programa es considerado ""no amigable"" y ""muy difícil de usar"". Esto puede indicar problemas de usabilidad que podrían afectar la satisfacción del usuario.

2. **Problemas con el idioma**: Un usuario menciona que el programa comete errores básicos en inglés y francés al traducir, lo cual puede ser frustrante para aquellos que buscan aprender correctamente un nuevo idioma.

3. **Dificultades con el español**: Otra reseña indica que el programa es especialmente complicado para quienes no tienen conocimientos básicos de español, lo cual limita su utilidad y eficacia como herramienta de aprendizaje.

4. **Desafíos con la gramática y pronunciación**: Se destaca que el programa puede resultar complicado en cuanto a la gramática, especialmente con los verbos y pronombres, aunque puede ser útil para trabajar en la pronunciación.

En conclusión, basándonos en estas opiniones, parece que este programa de aprendizaje de idiomas podría presentar desafíos significativos en términos de usabilidad y precisión lingüística. Los usuarios parecen experimentar dificultades para utilizarlo efectivamente, especialmente si no tienen conocimientos previos del idioma enseñado. La polaridad general de las opiniones es negativa debido a las limitaciones mencionadas por los usuarios.

Si deseas más información detallada o análisis específicos sobre algún aspecto en particular, por favor házmelo saber."
2024-10-12 17:21:35.796490,testing,"Basándome en las reseñas proporcionadas, aquí está el análisis de la aplicación mencionada:

- La aplicación fue probada durante aproximadamente 5 minutos y luego eliminada debido a que el test no era preciso y la imagen estaba un poco borrosa. Sin embargo, se destaca que la variedad de tests disponibles es positiva.

- Se menciona que competir con amigos es divertido, lo cual indica una característica socialmente atractiva de la aplicación.

- Se recomienda altamente este producto para aquellos que deseen mejorar su concentración y enfoque mental. Parece ser desafiante y estimulante en ese sentido.

- A pesar de tener juegos de Unity, al presionar ciertas áreas, redirige a sitios web desconocidos, lo cual genera confusión y desagrado.

En conclusión, aunque la aplicación ofrece una amplia variedad de tests y promueve la competencia amistosa, los problemas relacionados con la precisión del test y las redirecciones no deseadas pueden afectar negativamente la experiencia del usuario. La recomendación general sería mejorar la precisión de los tests y evitar redirecciones inesperadas para garantizar una experiencia más satisfactoria para los usuarios. 

Diagnóstico de polaridad: 
- Positivo: 2 reseñas
- Negativo: 2 reseñas

Es importante considerar tanto los aspectos positivos como los negativos mencionados por los usuarios para tomar decisiones informadas sobre el desarrollo y mejora continua de la aplicación."
2024-10-12 17:47:34.041013,"Amazon Prime Music no puede competir con Spotify en cuanto a la calidad de sonido, ¿cómo justifican los usuarios seguir usándolo?","Puedo ayudarte con el análisis de reseñas de productos en Amazon, proporcionando insights para mejorar la experiencia del cliente o el desarrollo de productos. ¿En qué área específica deseas que te ayude?"
2024-10-12 17:47:51.559510,对TurboTax的体验如何描述？,"Para analizar la experiencia del usuario con TurboTax, es importante destacar varios aspectos clave mencionados en las reseñas:

1. **Capacidad de predicción de impuestos para el año en curso**: El usuario expresó interés en la capacidad de TurboTax para predecir los impuestos del año actual (2021) basándose en las reglas fiscales del año anterior. Sin embargo, señaló que las predicciones eran inexactas y que algunas funcionalidades importantes estaban ausentes.

2. **Problemas técnicos y actualizaciones**: Se menciona que hubo dificultades al actualizar el software de TurboTax en un sistema Mac, lo que resultó en tener que presentar las declaraciones de impuestos por correo en lugar de hacerlo electrónicamente.

3. **Limitaciones geográficas**: Un usuario menciona que no pudo encontrar una descarga específica para Texas, lo cual le llevó a considerar buscar ayuda externa para completar sus impuestos.

4. **Comparación con H&R Block**: Otro usuario destaca su experiencia positiva con el software de H&R Block durante los últimos tres periodos fiscales, resaltando la facilidad de uso y el soporte continuo por parte de la empresa.

En conclusión, las reseñas sobre TurboTax reflejan una mezcla de opiniones. Mientras algunos usuarios encuentran limitaciones en la precisión y usabilidad del programa, otros prefieren alternativas como H&R Block debido a su fiabilidad y apoyo constante. Es importante considerar estos puntos al evaluar la experiencia general con TurboTax.

Diagnóstico de polaridad:
- Las opiniones sobre TurboTax varían desde críticas negativas hasta comentarios neutrales o ligeramente positivos.
- Existen preocupaciones sobre la precisión de cálculos, problemas técnicos y limitaciones geográficas.
- Algunos usuarios valoran aspectos como la facilidad de uso y el soporte ofrecido por otras plataformas como H&R Block.

¡Espero que esta información te resulte útil! Si necesitas más detalles o análisis específicos, ¡no dudes en preguntar!"
